{
  "schema": "mh.buildings",
  "schema_version": 1,
  "status": "PARAMETERS, NOT FINAL. Costs, score gates, land, upkeep and demo tiers are placeholders to be tuned by the economy simulation and remote config. Structure and prerequisite links are fixed by the Master Plan review results.",
  "score_scale": {
    "min": 0,
    "max": 100,
    "gate_basis": "average_hole_score"
  },
  "land": {
    "unit": "parcel",
    "holes_per_parcel": 3,
    "start_parcels": 2,
    "max_parcels": 9
  },
  "hole_cap": 18,
  "cost_multiplier_x100": [
    100,
    200,
    400,
    800,
    1400
  ],
  "rules": {
    "gates_persistent": true,
    "gates_checked_at_purchase_only": false,
    "note": "A purchased tier's dependencies (holes, buildings, land) cannot be demolished or sold while the tier stands."
  },
  "buildings": [
    {
      "id": "clubhouse",
      "name_key": "building.clubhouse.name",
      "desc_key": "building.clubhouse.desc",
      "base_cost": 20000,
      "land_class": "light",
      "demo_max_tier": 3,
      "tier3_specs": [
        {
          "id": "a",
          "name_key": "building.clubhouse.spec_a"
        },
        {
          "id": "b",
          "name_key": "building.clubhouse.spec_b"
        }
      ],
      "tiers": [
        {
          "tier": 1,
          "name_key": "building.clubhouse.tier1.name",
          "cost": 20000,
          "upkeep_per_day": 50,
          "requires": {
            "min_holes": 0,
            "min_avg_hole_score": 0,
            "min_parcels_owned": 2,
            "min_members": 0,
            "specific": [],
            "any_others": null,
            "hosted_tournament": null
          }
        },
        {
          "tier": 2,
          "name_key": "building.clubhouse.tier2.name",
          "cost": 40000,
          "upkeep_per_day": 100,
          "requires": {
            "min_holes": 6,
            "min_avg_hole_score": 25,
            "min_parcels_owned": 2,
            "min_members": 0,
            "specific": [],
            "any_others": null,
            "hosted_tournament": null
          }
        },
        {
          "tier": 3,
          "name_key": "building.clubhouse.tier3.name",
          "cost": 80000,
          "upkeep_per_day": 200,
          "requires": {
            "min_holes": 10,
            "min_avg_hole_score": 30,
            "min_parcels_owned": 3,
            "min_members": 0,
            "specific": [],
            "any_others": {
              "count": 1,
              "min_tier": 2
            },
            "hosted_tournament": null
          }
        },
        {
          "tier": 4,
          "name_key": "building.clubhouse.tier4.name",
          "cost": 160000,
          "upkeep_per_day": 400,
          "requires": {
            "min_holes": 14,
            "min_avg_hole_score": 36,
            "min_parcels_owned": 5,
            "min_members": 50,
            "specific": [],
            "any_others": {
              "count": 2,
              "min_tier": 3
            },
            "hosted_tournament": null
          }
        },
        {
          "tier": 5,
          "name_key": "building.clubhouse.tier5.name",
          "cost": 280000,
          "upkeep_per_day": 700,
          "requires": {
            "min_holes": 18,
            "min_avg_hole_score": 42,
            "min_parcels_owned": 7,
            "min_members": 0,
            "specific": [],
            "any_others": null,
            "hosted_tournament": {
              "min_level": "local"
            }
          }
        }
      ]
    },
    {
      "id": "pro_shop",
      "name_key": "building.pro_shop.name",
      "desc_key": "building.pro_shop.desc",
      "base_cost": 8000,
      "land_class": "light",
      "demo_max_tier": 2,
      "tier3_specs": [
        {
          "id": "a",
          "name_key": "building.pro_shop.spec_a"
        },
        {
          "id": "b",
          "name_key": "building.pro_shop.spec_b"
        }
      ],
      "tiers": [
        {
          "tier": 1,
          "name_key": "building.pro_shop.tier1.name",
          "cost": 8000,
          "upkeep_per_day": 20,
          "requires": {
            "min_holes": 0,
            "min_avg_hole_score": 0,
            "min_parcels_owned": 2,
            "min_members": 0,
            "specific": [],
            "any_others": null,
            "hosted_tournament": null
          }
        },
        {
          "tier": 2,
          "name_key": "building.pro_shop.tier2.name",
          "cost": 16000,
          "upkeep_per_day": 40,
          "requires": {
            "min_holes": 6,
            "min_avg_hole_score": 25,
            "min_parcels_owned": 2,
            "min_members": 0,
            "specific": [],
            "any_others": null,
            "hosted_tournament": null
          }
        },
        {
          "tier": 3,
          "name_key": "building.pro_shop.tier3.name",
          "cost": 32000,
          "upkeep_per_day": 80,
          "requires": {
            "min_holes": 10,
            "min_avg_hole_score": 30,
            "min_parcels_owned": 3,
            "min_members": 0,
            "specific": [],
            "any_others": {
              "count": 1,
              "min_tier": 2
            },
            "hosted_tournament": null
          }
        },
        {
          "tier": 4,
          "name_key": "building.pro_shop.tier4.name",
          "cost": 64000,
          "upkeep_per_day": 160,
          "requires": {
            "min_holes": 14,
            "min_avg_hole_score": 36,
            "min_parcels_owned": 5,
            "min_members": 50,
            "specific": [
              {
                "building": "driving_range",
                "min_tier": 3
              }
            ],
            "any_others": {
              "count": 2,
              "min_tier": 3
            },
            "hosted_tournament": null
          }
        },
        {
          "tier": 5,
          "name_key": "building.pro_shop.tier5.name",
          "cost": 112000,
          "upkeep_per_day": 280,
          "requires": {
            "min_holes": 18,
            "min_avg_hole_score": 42,
            "min_parcels_owned": 7,
            "min_members": 0,
            "specific": [],
            "any_others": null,
            "hosted_tournament": {
              "min_level": "local"
            }
          }
        }
      ]
    },
    {
      "id": "driving_range",
      "name_key": "building.driving_range.name",
      "desc_key": "building.driving_range.desc",
      "base_cost": 12000,
      "land_class": "heavy",
      "demo_max_tier": 2,
      "tier3_specs": [
        {
          "id": "a",
          "name_key": "building.driving_range.spec_a"
        },
        {
          "id": "b",
          "name_key": "building.driving_range.spec_b"
        }
      ],
      "tiers": [
        {
          "tier": 1,
          "name_key": "building.driving_range.tier1.name",
          "cost": 12000,
          "upkeep_per_day": 30,
          "requires": {
            "min_holes": 0,
            "min_avg_hole_score": 0,
            "min_parcels_owned": 2,
            "min_members": 0,
            "specific": [],
            "any_others": null,
            "hosted_tournament": null
          }
        },
        {
          "tier": 2,
          "name_key": "building.driving_range.tier2.name",
          "cost": 24000,
          "upkeep_per_day": 60,
          "requires": {
            "min_holes": 6,
            "min_avg_hole_score": 25,
            "min_parcels_owned": 3,
            "min_members": 0,
            "specific": [],
            "any_others": null,
            "hosted_tournament": null
          }
        },
        {
          "tier": 3,
          "name_key": "building.driving_range.tier3.name",
          "cost": 48000,
          "upkeep_per_day": 120,
          "requires": {
            "min_holes": 10,
            "min_avg_hole_score": 30,
            "min_parcels_owned": 4,
            "min_members": 0,
            "specific": [],
            "any_others": {
              "count": 1,
              "min_tier": 2
            },
            "hosted_tournament": null
          }
        },
        {
          "tier": 4,
          "name_key": "building.driving_range.tier4.name",
          "cost": 96000,
          "upkeep_per_day": 240,
          "requires": {
            "min_holes": 14,
            "min_avg_hole_score": 36,
            "min_parcels_owned": 6,
            "min_members": 50,
            "specific": [],
            "any_others": {
              "count": 2,
              "min_tier": 3
            },
            "hosted_tournament": null
          }
        },
        {
          "tier": 5,
          "name_key": "building.driving_range.tier5.name",
          "cost": 168000,
          "upkeep_per_day": 420,
          "requires": {
            "min_holes": 18,
            "min_avg_hole_score": 42,
            "min_parcels_owned": 8,
            "min_members": 0,
            "specific": [],
            "any_others": null,
            "hosted_tournament": {
              "min_level": "local"
            }
          }
        }
      ]
    },
    {
      "id": "restaurant",
      "name_key": "building.restaurant.name",
      "desc_key": "building.restaurant.desc",
      "base_cost": 15000,
      "land_class": "light",
      "demo_max_tier": 0,
      "tier3_specs": [
        {
          "id": "a",
          "name_key": "building.restaurant.spec_a"
        },
        {
          "id": "b",
          "name_key": "building.restaurant.spec_b"
        }
      ],
      "tiers": [
        {
          "tier": 1,
          "name_key": "building.restaurant.tier1.name",
          "cost": 15000,
          "upkeep_per_day": 37,
          "requires": {
            "min_holes": 0,
            "min_avg_hole_score": 0,
            "min_parcels_owned": 2,
            "min_members": 0,
            "specific": [],
            "any_others": null,